Grapheme	IPA	FREQUENCY	CODEPOINTS	EXAMPLES	LANGUAGES
^	NULL	333	U+005E		
$	NULL	4464	U+0024		
.	NULL	15	U+002E	"ʂíe.kɑ̄́ri,ʂíkɯ̄́.rɑ́ɯje,ʂɑ̄́wɑ̄́.rī́"	Wixarika (Huichol), Tongva (Gabrielino), Orayvi Hopi, Cora, Ipai, Pipil
$	NULL	6	U+F1B8 U+0024	"kɯgɑd,nɯid,tɑtkɑd"	Tohono O'odham, Pima Bajo
^īʃ$	iː ʃ	2	U+005E U+012B U+0283 U+0024	"īʃ"	Pipil
^mon‑$	m o n	2	U+005E U+006D U+006F U+006E U+2011 U+0024	"mon‑"	
^č̓ɛ̃̀ɁĭɁ$	tʃˀ ɛˀ ʔ ĭ ʔ	1	U+005E U+010D U+0313 U+025B U+0303 U+0300 U+0241 U+012D U+0241 U+0024	"č̓ɛ̃̀ɁĭɁ"	
^̱ɑ̱ntewɑ̄$	ɑ n t e w ɑː	1	U+005E U+0331 U+0251 U+0331 U+006E U+0074 U+0065 U+0077 U+0251 U+0304 U+0024	"̱ɑ̱ntewɑ̄"	
-	+	22	U+002D	"mo̱knu-,tukʷɑ-,‑tʃe̱xen-"	Wixarika (Huichol), Southern Paiute, Cahuilla, Tubar, Kawaiisu, Luiseño, Chemehuevi, S Tepehuan, Western Mono, Pima Bajo, N Tepehuan
_	+	1	U+005F	"tɑm_βu̱wɑ"	Ópata, Orayvi Hopi, Zuni, Tohono O'odham
a	a	22	U+0061	"fa,fahãŋ,hujja"	Tewa, Kitanemuk, Orayvi Hopi, Pahkannil (Tübatulabal), Luiseño, Cora, Comanche, Pima Bajo
b	b	32	U+0062	"hi̱bes,hɑube,kūbúʃi"	Kawaiisu, Eudeve, Rarámuri, Pima Bajo, Ópata, Tohono O'odham, Cora, S Tepehuan, Mayo, Guarijío, N Tepehuan
c	c	5	U+0063	"kɑicuk,kɑ́íci,ɑ̄ciʔ"	
d	d	102	U+0064	"dɑ́xɑ,gɑd,utúdɯ"	N Tepehuan, Tohono O'odham, Pima Bajo, S Tepehuan, Eudeve, Ópata, Pipil
e	e	640	U+0065	"be,hetʃɯ̄r,tˡetˡ"	Ipai, Tetelcingo Mexicano, Pochutla Mexicano, Classical Nahuatl, Pipil, Arizona Yoeme (Yaqui), Eudeve, Cora, Guarijío, Wixarika (Huichol), Tubar, Cahuilla, Mayo, Ópata, Kawaiisu, Tewa, Comanche, Zuni, Tongva (Gabrielino), Luiseño, Tümpisa Shoshone (Panamint,Koso), Western Shoshone, Shoshone, Big Smokey Valley Shoshone, Rarámuri, Acjachemen (Juaneño), Cupeño, Orayvi Hopi, Pahkannil (Tübatulabal), Kitanemuk, Western Mono
f	f	2	U+0066	"sifik̓ũ,tʃehitʃf"	Tewa
g	g	98	U+0067	"wɑ̄g,ɑjɑgo,ɯgi"	N Tepehuan, Tohono O'odham, Pima Bajo, Guarijío, Pochutla Mexicano, Rarámuri, S Tepehuan, Tewa, Eudeve, Ópata
h	h	408	U+0068	"juhupɯ,mɑhɑ̄t,mɯihim"	Guarijío, Comanche, Western Mono, Ipai, Cora, Tümpisa Shoshone (Panamint,Koso), Kawaiisu, Orayvi Hopi, Big Smokey Valley Shoshone, Northern Paiute, Western Shoshone, Shoshone, Tetelcingo Mexicano, Pipil, Pima Bajo, Chemehuevi, Tohono O'odham, Kitanemuk, Arizona Yoeme (Yaqui), Pahkannil (Tübatulabal), Rarámuri, Tubar, Mayo, S Tepehuan, Tongva (Gabrielino), Eudeve, Southern Paiute, Tewa, Zuni, Ópata, Luiseño, Serrano, Wixarika (Huichol)
i	i	1964	U+0069	"huittˢu,pūnnīkɑi,simi̱"	Tetelcingo Mexicano, Tümpisa Shoshone (Panamint,Koso), Classical Nahuatl, Big Smokey Valley Shoshone, Southern Ute, Kawaiisu, Pipil, Shoshone, Chemehuevi, Western Shoshone, Comanche, Zuni, Cupeño, Cahuilla, Tongva (Gabrielino), Tohono O'odham, S Tepehuan, Arizona Yoeme (Yaqui), Pahkannil (Tübatulabal), Kitanemuk, Ipai, Mayo, Pima Bajo, Serrano, Orayvi Hopi, Southern Paiute, Northern Paiute, Tewa, Luiseño, Wixarika (Huichol), Rarámuri, Tubar, Ópata, Guarijío, Western Mono, Pochutla Mexicano, Eudeve, Cora, N Tepehuan, Acjachemen (Juaneño)
j	j	283	U+006A	"mɯ̄jɑw,pɑβɑtsɑjʔeʔ,qʷɑ̱jɑqʷjɑʃ"	Orayvi Hopi, Ipai, Luiseño, Western Mono, Tetelcingo Mexicano, Kawaiisu, Comanche, Wixarika (Huichol), Zuni, Tongva (Gabrielino), Western Shoshone, Acjachemen (Juaneño), Tümpisa Shoshone (Panamint,Koso), Tubar, Tewa, Cora, Pahkannil (Tübatulabal), Mayo, Southern Ute, Pipil, Cupeño, Big Smokey Valley Shoshone, Shoshone, Cahuilla, Arizona Yoeme (Yaqui), Southern Paiute, Classical Nahuatl, Rarámuri, Pochutla Mexicano, Northern Paiute, Kitanemuk, Guarijío, Chemehuevi, Pima Bajo, N Tepehuan
k	k	702	U+006B	"nɑ̄̌kɑ,puike,wi̱kitmɑl"	Tetelcingo Mexicano, Kawaiisu, Orayvi Hopi, N Tepehuan, Southern Ute, Big Smokey Valley Shoshone, Comanche, Pipil, Tubar, Western Shoshone, Rarámuri, Arizona Yoeme (Yaqui), Chemehuevi, Southern Paiute, Classical Nahuatl, Tümpisa Shoshone (Panamint,Koso), Wixarika (Huichol), Cahuilla, Pochutla Mexicano, Tongva (Gabrielino), Cora, Shoshone, Pahkannil (Tübatulabal), Mayo, Northern Paiute, Zuni, Eudeve, Western Mono, Guarijío, Kitanemuk, Cupeño, S Tepehuan, Tohono O'odham, Ópata, Pima Bajo, Luiseño, Acjachemen (Juaneño), Tewa, Ipai, Serrano
l	l	354	U+006C	"heli,kwitɑpil,nɑ̱qɑl"	Luiseño, Tetelcingo Mexicano, Zuni, Pipil, Classical Nahuatl, Cahuilla, Rarámuri, Pahkannil (Tübatulabal), Tubar, Cupeño, Acjachemen (Juaneño), Mayo, Ipai, Arizona Yoeme (Yaqui), Guarijío, Orayvi Hopi, Pima Bajo, Pochutla Mexicano, Tohono O'odham, N Tepehuan, Cora, Wixarika (Huichol)
m	m	502	U+006D	"tokōko moʔle,tɑmi,ɯ̄mɯhɯɁ"	Cahuilla, Tümpisa Shoshone (Panamint,Koso), Ipai, Rarámuri, Southern Paiute, Orayvi Hopi, Big Smokey Valley Shoshone, Tubar, Luiseño, Tetelcingo Mexicano, Tongva (Gabrielino), Shoshone, Kawaiisu, N Tepehuan, Guarijío, Kitanemuk, Comanche, Arizona Yoeme (Yaqui), Western Shoshone, Cupeño, Serrano, Chemehuevi, Pahkannil (Tübatulabal), Classical Nahuatl, Acjachemen (Juaneño), Pipil, Wixarika (Huichol), Western Mono, Northern Paiute, Pima Bajo, Pochutla Mexicano, Mayo, Southern Ute, Ópata, Eudeve, Zuni, Cora, Tewa, Tohono O'odham, S Tepehuan
n	n	729	U+006E	"kulɑ̄n,nini̱r,ɑjnɑ"	Guarijío, Tetelcingo Mexicano, Kawaiisu, Big Smokey Valley Shoshone, Comanche, Western Mono, Zuni, Pahkannil (Tübatulabal), Shoshone, Pipil, Tongva (Gabrielino), Cora, Southern Ute, Tümpisa Shoshone (Panamint,Koso), Orayvi Hopi, Chemehuevi, Classical Nahuatl, Cahuilla, Cupeño, Western Shoshone, Arizona Yoeme (Yaqui), Tubar, Rarámuri, Northern Paiute, Mayo, Pochutla Mexicano, Luiseño, Southern Paiute, Wixarika (Huichol), Eudeve, Kitanemuk, N Tepehuan, Ipai, Ópata, Acjachemen (Juaneño), S Tepehuan, Serrano, Pima Bajo, Tewa, Tohono O'odham
o	o	706	U+006F	"horo-,o̱tʃoko,topɑxɑro̱"	Tongva (Gabrielino), Tetelcingo Mexicano, Zuni, Orayvi Hopi, Kawaiisu, Big Smokey Valley Shoshone, Guarijío, Tohono O'odham, Tümpisa Shoshone (Panamint,Koso), Tubar, Classical Nahuatl, Western Shoshone, Comanche, S Tepehuan, Pima Bajo, Chemehuevi, Northern Paiute, Shoshone, Western Mono, Kitanemuk, Rarámuri, Pochutla Mexicano, Tewa, Arizona Yoeme (Yaqui), Mayo, Acjachemen (Juaneño), Southern Ute, N Tepehuan, Luiseño, Eudeve, Pahkannil (Tübatulabal), Ópata, Southern Paiute, Serrano, Wixarika (Huichol)
p	p	506	U+0070	"tsī̑pɯ,tɑtˢiʔɯmpin,tɑŋɑpi"	Kawaiisu, Southern Ute, Chemehuevi, Southern Paiute, Tümpisa Shoshone (Panamint,Koso), Comanche, Shoshone, Big Smokey Valley Shoshone, Northern Paiute, Western Mono, Western Shoshone, Orayvi Hopi, Tongva (Gabrielino), Kitanemuk, Guarijío, Ipai, N Tepehuan, Pahkannil (Tübatulabal), Rarámuri, Arizona Yoeme (Yaqui), Cora, Zuni, Tohono O'odham, Pipil, Classical Nahuatl, Mayo, Cupeño, Tetelcingo Mexicano, S Tepehuan, Pochutla Mexicano, Wixarika (Huichol), Ópata, Luiseño, Tubar, Serrano, Cahuilla, Acjachemen (Juaneño), Pima Bajo, Eudeve, Tewa
q	q	43	U+0071	"mɑqɑ,nɑqmɑ,tʃɑq"	Orayvi Hopi, Serrano, Cahuilla, Western Mono, Kitanemuk, Cupeño, Luiseño, Acjachemen (Juaneño), Ipai
r	r	216	U+0072	"njoli̱r,qɑrβɑ̄tʃ,tomo̱ɑri"	Cora, Wixarika (Huichol), Tubar, Rarámuri, Guarijío, Tongva (Gabrielino), Mayo, Ópata, Eudeve, N Tepehuan, Orayvi Hopi, Serrano, Ipai, Arizona Yoeme (Yaqui), Tewa, Pima Bajo, Luiseño, Kitanemuk, Acjachemen (Juaneño), Southern Paiute, Northern Paiute, Comanche
s	s	276	U+0073	"nɑmusi̱r,pɯ̄sippɯh,tsiwɑβi"	Tümpisa Shoshone (Panamint,Koso), Big Smokey Valley Shoshone, Tubar, Western Shoshone, Comanche, Cora, Shoshone, Chemehuevi, Ipai, Western Mono, Northern Paiute, Mayo, Rarámuri, Arizona Yoeme (Yaqui), Kawaiisu, Eudeve, Classical Nahuatl, Pipil, Guarijío, Orayvi Hopi, Pochutla Mexicano, Ópata, Southern Ute, Zuni, Cupeño, Tetelcingo Mexicano, Tongva (Gabrielino), N Tepehuan, Cahuilla, S Tepehuan, Southern Paiute
t	t	774	U+0074	"kwɑkwɑwitl,terɑ̱t,ʃoʃoktik"	Tetelcingo Mexicano, Classical Nahuatl, Pipil, Tümpisa Shoshone (Panamint,Koso), Comanche, Kawaiisu, Kitanemuk, Western Mono, Orayvi Hopi, Big Smokey Valley Shoshone, Southern Ute, Serrano, Zuni, Tongva (Gabrielino), Tubar, Pochutla Mexicano, Western Shoshone, Chemehuevi, Cora, Shoshone, N Tepehuan, Arizona Yoeme (Yaqui), Southern Paiute, Wixarika (Huichol), Guarijío, Northern Paiute, Mayo, Rarámuri, Pima Bajo, Ipai, Cupeño, Luiseño, Pahkannil (Tübatulabal), Tohono O'odham, S Tepehuan, Eudeve, Ópata, Acjachemen (Juaneño), Cahuilla
u	u	698	U+0075	"pi̱ju,tūkut,uʔuwhig"	Kawaiisu, Pahkannil (Tübatulabal), Chemehuevi, Luiseño, Tümpisa Shoshone (Panamint,Koso), Southern Ute, Pipil, Southern Paiute, Kitanemuk, Big Smokey Valley Shoshone, S Tepehuan, Guarijío, Tohono O'odham, Comanche, Rarámuri, Cupeño, Wixarika (Huichol), Shoshone, Tewa, Western Shoshone, Pima Bajo, Pochutla Mexicano, Northern Paiute, N Tepehuan, Arizona Yoeme (Yaqui), Serrano, Tongva (Gabrielino), Cora, Western Mono, Cahuilla, Mayo, Zuni, Eudeve, Tubar, Ópata, Acjachemen (Juaneño), Orayvi Hopi
w	w	288	U+0077	"niwɑ,tuɁurɑwɑ̱,ɑwiteli"	Chemehuevi, Rarámuri, Cupeño, Ópata, Orayvi Hopi, Tetelcingo Mexicano, Guarijío, Kawaiisu, Cahuilla, Eudeve, Zuni, Southern Ute, Pipil, Western Mono, Tewa, Pahkannil (Tübatulabal), Mayo, Arizona Yoeme (Yaqui), Northern Paiute, Tohono O'odham, Acjachemen (Juaneño), Luiseño, Classical Nahuatl, Tümpisa Shoshone (Panamint,Koso), Tongva (Gabrielino), Wixarika (Huichol), Tubar, Shoshone, Ipai, Western Shoshone, Comanche, Cora, Serrano, Kitanemuk, Pima Bajo, Pochutla Mexicano, Big Smokey Valley Shoshone
x	x	75	U+0078	"tɑ̱̄xɑt,tʃixnin,wiʃiʔɑxɑ̄r"	Tongva (Gabrielino), Cahuilla, Cupeño, Luiseño, N Tepehuan, Acjachemen (Juaneño), Tewa, Zuni, Classical Nahuatl
y	y	1	U+0079	"ēwɑyu"	Pipil
à	à	3	U+00E0	"màn,xowà,θàn"	Tewa
á	á	8	U+00E1	"oɁk̓áβeh,tēmá,ɯmádo"	Wixarika (Huichol), N Tepehuan, Tewa
â	â	1	U+00E2	"ʔân"	Tewa
ã	ã	8	U+00E3	"hãn,mãn,mãnnjɑ"	Tewa
é	é	12	U+00E9	"némɑ,tsé,téβí"	Wixarika (Huichol), Tewa
ì	ì	2	U+00EC	"hejì,p̓ìn"	Tewa
í	í	41	U+00ED	"kɑ́íci,t̓ɛ̃hkíh,ɯ̄píɉi"	N Tepehuan, Wixarika (Huichol), Tewa, S Tepehuan
ð	ð	2	U+00F0	"ɑwɑð,ɯliðɑg"	Tohono O'odham
ó	ó	10	U+00F3	"kómi,tɯ̄dógi,Ɂagójóh"	N Tepehuan, Tewa
ø	ø	18	U+00F8	"tˢønɑ,wɑɁø,wɑɁøk"	Orayvi Hopi
ú	ú	15	U+00FA	"kúpɑi,tūkúgɑ,βúɑ́mɑ"	N Tepehuan, Tewa, Luiseño
ā	ā	2	U+0101	"māl,māts"	Kitanemuk, Pahkannil (Tübatulabal)
ē	ē	75	U+0113	"nēni̱,nɑ̄kkē,tētḗ"	Tetelcingo Mexicano, Arizona Yoeme (Yaqui), Wixarika (Huichol), Classical Nahuatl, Mayo, Pipil, Cora, Tongva (Gabrielino), Kawaiisu, Orayvi Hopi, Zuni, Ipai, Tewa
ī	ī	150	U+012B	"kiʎī,tʃepesī,ɑppɯiī"	Tetelcingo Mexicano, Classical Nahuatl, Comanche, Serrano, Pipil, Ipai, Southern Ute, Pima Bajo, Shoshone, Tümpisa Shoshone (Panamint,Koso), Arizona Yoeme (Yaqui), Kawaiisu, Orayvi Hopi, Western Shoshone, Kitanemuk, Mayo, S Tepehuan, Pahkannil (Tübatulabal), Guarijío, Chemehuevi, Cora, Southern Paiute, Big Smokey Valley Shoshone, Northern Paiute, Tohono O'odham
ĭ	ĭ	2	U+012D	"tseɁĭɁ,tʃɛ̃̄́ʔĭʔ"	Tewa
ŋ	ŋ	65	U+014B	"iŋilɑɁɑn,leŋi,nɑŋkɑpɑ"	Orayvi Hopi, Pahkannil (Tübatulabal), Tümpisa Shoshone (Panamint,Koso), Chemehuevi, Cupeño, Luiseño, Southern Paiute, Tongva (Gabrielino), Cahuilla, Zuni, Ipai, Serrano, Acjachemen (Juaneño), Kitanemuk, Tewa
ō	ō	133	U+014D	"pōtʃɯt,tōnɑlli,ōʔo"	Classical Nahuatl, Tetelcingo Mexicano, Comanche, S Tepehuan, Pahkannil (Tübatulabal), Pima Bajo, Tohono O'odham, Mayo, Arizona Yoeme (Yaqui), Orayvi Hopi, Tümpisa Shoshone (Panamint,Koso), Chemehuevi, Tongva (Gabrielino), Big Smokey Valley Shoshone, Northern Paiute, Shoshone, Western Shoshone, Kitanemuk, Kawaiisu, Southern Paiute, Western Mono, Tewa, Serrano, N Tepehuan, Zuni, Southern Ute, Acjachemen (Juaneño)
ũ	ũ	7	U+0169	"kũwe,ũʔũ,ʃũŋ"	Tewa
ū	ū	121	U+016B	"kūjɑ̄́-,ɑpūtˢ,ɑ̄kkɑnūttʃi"	Pahkannil (Tübatulabal), S Tepehuan, Serrano, Pipil, Wixarika (Huichol), Southern Ute, Kitanemuk, Tohono O'odham, Kawaiisu, Tongva (Gabrielino), Mayo, Pima Bajo, Arizona Yoeme (Yaqui), N Tepehuan, Chemehuevi, Luiseño, Comanche, Southern Paiute, Orayvi Hopi, Cora, Big Smokey Valley Shoshone, Northern Paiute, Shoshone, Acjachemen (Juaneño)
ǔ	ǔ	1	U+01D4	"kǔpɑ"	N Tepehuan
Ɂ	ʔ	148	U+0241	"hɑɁɑtɑlunt,nɑɁ,ɑpɑɁnɑttɯ"	
ɉ	ɟ	12	U+0249	"biɉ,nɯiɉɑ,ʔoiɉɑʔ"	N Tepehuan, S Tepehuan, Pima Bajo
ɑ	ɑ	2704	U+0251	"mɑsɑ̱t,ɑjɑ̱li,βɑ̄ʔɑ"	Southern Ute, Chemehuevi, Tümpisa Shoshone (Panamint,Koso), Big Smokey Valley Shoshone, Kawaiisu, Comanche, Southern Paiute, Shoshone, Western Shoshone, Zuni, Cora, Kitanemuk, Tetelcingo Mexicano, Rarámuri, Pipil, Tubar, Cahuilla, Pahkannil (Tübatulabal), Arizona Yoeme (Yaqui), Tohono O'odham, Classical Nahuatl, Cupeño, Western Mono, Northern Paiute, Mayo, Guarijío, Orayvi Hopi, Tongva (Gabrielino), Ópata, Pima Bajo, Acjachemen (Juaneño), Ipai, Serrano, Luiseño, S Tepehuan, Eudeve, N Tepehuan, Pochutla Mexicano, Wixarika (Huichol), Tewa
ɖ	ɖ	8	U+0256	"sikoɖ,tɑɖ,ɯ̄ʔɯɖ"	Tohono O'odham
ə	ə	38	U+0259	"kənəkə̱nəɁɑʃ,pəlɑ,əβət"	Cupeño
ɬ	ɬ	17	U+026C	"esɑɬj,ɲiɬj,ʔempiɬ"	Ipai, Zuni
ɯ	ɯ	1007	U+026F	"tɯʔɑhweh,tˢɯ̄́kɯ,ɯ̄ʔɯɖ"	Tümpisa Shoshone (Panamint,Koso), Big Smokey Valley Shoshone, Shoshone, Western Shoshone, Pima Bajo, Southern Ute, Comanche, Chemehuevi, Kitanemuk, Tohono O'odham, Southern Paiute, Pahkannil (Tübatulabal), Kawaiisu, Northern Paiute, Ipai, Orayvi Hopi, Serrano, Western Mono, N Tepehuan, S Tepehuan, Cora, Wixarika (Huichol), Arizona Yoeme (Yaqui), Tongva (Gabrielino), Mayo
ɲ	ɲ	25	U+0272	"hɑɲɑ̱,tɯiɲ,Ɂeɲɑ̄wɑptʃ"	Ipai, Serrano, Tohono O'odham, N Tepehuan, S Tepehuan, Cahuilla, Tubar
ʂ	ʂ	26	U+0282	"hɯʂí,mɑʂɑd,wɑwβɑʂiʃ"	Wixarika (Huichol), Cupeño, Tohono O'odham, Kitanemuk, Tongva (Gabrielino), Luiseño, Serrano, Pima Bajo
ʃ	ʃ	132	U+0283	"iʃtotolut,kuʃíβu,kʷetɑʃti"	Pochutla Mexicano, Pahkannil (Tübatulabal), Zuni, Tetelcingo Mexicano, Classical Nahuatl, Ipai, Pipil, N Tepehuan, Southern Paiute, Cahuilla, Pima Bajo, Luiseño, Acjachemen (Juaneño), Kawaiisu, Tongva (Gabrielino), Tohono O'odham, S Tepehuan
ʎ	ʎ	28	U+028E	"putʃiʎ,su̱pʎi,wiʎ"	Cahuilla, S Tepehuan, Cupeño
ʔ	ʔ	483	U+0294	"nɑʔi̱,ɑnōʔtˢiʔ,ɯ̄tɯ̄ʔɯt"	Kawaiisu, Tohono O'odham, Tongva (Gabrielino), Zuni, Guarijío, Pima Bajo, Cahuilla, Cupeño, Cora, Tümpisa Shoshone (Panamint,Koso), Chemehuevi, Kitanemuk, Luiseño, Southern Paiute, Western Shoshone, Rarámuri, S Tepehuan, Comanche, Arizona Yoeme (Yaqui), Big Smokey Valley Shoshone, Serrano, Mayo, Western Mono, Pahkannil (Tübatulabal), Classical Nahuatl, Southern Ute, Northern Paiute, Shoshone, Orayvi Hopi, Wixarika (Huichol), Tewa, Acjachemen (Juaneño)
β	β	148	U+03B2	"qɑʳβɑ̄t,ɑ̄β,ɑ̱̓hɑuβe"	Eudeve, Luiseño, Acjachemen (Juaneño), Cupeño, Wixarika (Huichol), Kitanemuk, Serrano, Arizona Yoeme (Yaqui), N Tepehuan, Orayvi Hopi, Cora, S Tepehuan, Cahuilla, Pima Bajo, Ópata, Tongva (Gabrielino), Tewa, Mayo, Tubar
ḗ	eː	11	U+1E17	"nḗ,tɑ̄mḗ,tḗ.wɑ̄́"	Wixarika (Huichol)
ḵ	ḵ/k	13	U+1E35	"juɑ̄ḵɑiɑm,ɯḵ,ḵuḵut"	Serrano
ṓ	oː	6	U+1E53	"p̓ṓ,ṓdɑmi,ṓrɑi"	N Tepehuan
ẖ	ẖ/h	1	U+1E96	"wɑẖɑi"	Western Mono
ẽ	ẽ	1	U+1EBD	"sẽɲ"	Tewa
'l	l	1	U+0027 U+006C	"kug'li"	Pochutla Mexicano
-ⁿ	+ n	1	U+002D U+207F	"pɑki-ⁿ"	
^b	b	26	U+005E U+0062	"be,bid,buwe̱"	Rarámuri, Pima Bajo, Eudeve, Tewa, Tohono O'odham, S Tepehuan, Ópata, N Tepehuan
^c	c	5	U+005E U+0063	"coiɲ,cuɑ,cɯɯdoʔ"	S Tepehuan
^e	e	52	U+005E U+0065	"ehɯ̄,eltɑpɑtʃ,erɑ"	Ipai, Pipil, Guarijío, Comanche, Arizona Yoeme (Yaqui), Kawaiisu, Pochutla Mexicano, Big Smokey Valley Shoshone, Tubar, Shoshone, Western Shoshone, Zuni, Mayo, Tümpisa Shoshone (Panamint,Koso), Tongva (Gabrielino), Luiseño, Eudeve, Wixarika (Huichol), Western Mono, Pahkannil (Tübatulabal), Classical Nahuatl, Rarámuri, Ópata
^f	f	7	U+005E U+0066	"fe,fén,fóh"	Tewa
^g	g	39	U+005E U+0067	"gīgɯ,gō̌kui,gū́kɑ"	Pima Bajo, S Tepehuan, N Tepehuan, Tohono O'odham, Ópata, Pochutla Mexicano, Eudeve, Rarámuri
^h	h	270	U+005E U+0068	"hiliwɑ̱,hūβi,hɑʔjɑtʃinne"	Tohono O'odham, Arizona Yoeme (Yaqui), Wixarika (Huichol), Tubar, Pima Bajo, Mayo, Ipai, Cora, Comanche, Kawaiisu, Orayvi Hopi, Chemehuevi, Eudeve, Cahuilla, Big Smokey Valley Shoshone, Shoshone, Serrano, Kitanemuk, Zuni, Tümpisa Shoshone (Panamint,Koso), S Tepehuan, Pahkannil (Tübatulabal), Cupeño, Luiseño, Tewa, Northern Paiute, Western Shoshone, Ópata, Western Mono, Acjachemen (Juaneño), Tongva (Gabrielino), Guarijío, Rarámuri
^i	i	111	U+005E U+0069	"ilitʃi,itinɑ,itsɯ"	Classical Nahuatl, Pipil, Kawaiisu, Tubar, Zuni, Pima Bajo, Pahkannil (Tübatulabal), Arizona Yoeme (Yaqui), Pochutla Mexicano, Northern Paiute, Tetelcingo Mexicano, Guarijío, Orayvi Hopi, Wixarika (Huichol), Kitanemuk, Rarámuri, Mayo, Southern Ute, Chemehuevi, Luiseño, Southern Paiute, Western Mono, Serrano, Tohono O'odham, Comanche, Cupeño, S Tepehuan, Tongva (Gabrielino), Tewa, Western Shoshone, N Tepehuan, Cahuilla, Acjachemen (Juaneño)
^j	j	147	U+005E U+006A	"jomɑ̱gɑ,jōwi,jɑ̱wki"	Luiseño, Arizona Yoeme (Yaqui), Pipil, Tetelcingo Mexicano, Guarijío, Cahuilla, Kawaiisu, Southern Paiute, Mayo, Cupeño, Tongva (Gabrielino), Big Smokey Valley Shoshone, Northern Paiute, Shoshone, Western Shoshone, Zuni, Southern Ute, Orayvi Hopi, Chemehuevi, Wixarika (Huichol), Western Mono, Classical Nahuatl, Tümpisa Shoshone (Panamint,Koso), Pahkannil (Tübatulabal), Comanche, Pochutla Mexicano, Tewa, Rarámuri, Acjachemen (Juaneño), Tubar, Serrano, Kitanemuk, N Tepehuan, Ipai
^k	k	413	U+005E U+006B	"kiʎī,kēpi,kɑmɑk"	Pima Bajo, N Tepehuan, Tohono O'odham, Tetelcingo Mexicano, Kitanemuk, Big Smokey Valley Shoshone, S Tepehuan, Guarijío, Chemehuevi, Tubar, Shoshone, Tümpisa Shoshone (Panamint,Koso), Southern Paiute, Rarámuri, Southern Ute, Wixarika (Huichol), Kawaiisu, Eudeve, Classical Nahuatl, Pipil, Arizona Yoeme (Yaqui), Western Mono, Mayo, Cahuilla, Cora, Luiseño, Northern Paiute, Pahkannil (Tübatulabal), Western Shoshone, Pochutla Mexicano, Cupeño, Comanche, Ópata, Tongva (Gabrielino), Orayvi Hopi, Tewa, Serrano, Acjachemen (Juaneño), Zuni, Ipai
^l	l	24	U+005E U+006C	"lō̱βi,lō̱βɑ,lɑkpɯ"	Zuni, Orayvi Hopi, Acjachemen (Juaneño), Ipai, Pahkannil (Tübatulabal), Pochutla Mexicano, Luiseño, Rarámuri, S Tepehuan, Cahuilla, Pima Bajo
^m	m	396	U+005E U+006D	"moʳɑ̄ʔt,màn,mɑhti̱ɑ"	Chemehuevi, Tohono O'odham, Rarámuri, Pipil, Kawaiisu, Tubar, Kitanemuk, Classical Nahuatl, Tümpisa Shoshone (Panamint,Koso), Pima Bajo, Orayvi Hopi, Luiseño, Guarijío, Southern Paiute, Pahkannil (Tübatulabal), Southern Ute, Acjachemen (Juaneño), Tetelcingo Mexicano, S Tepehuan, Eudeve, N Tepehuan, Cupeño, Pochutla Mexicano, Big Smokey Valley Shoshone, Serrano, Mayo, Ópata, Arizona Yoeme (Yaqui), Wixarika (Huichol), Northern Paiute, Western Shoshone, Cora, Tongva (Gabrielino), Shoshone, Comanche, Cahuilla, Ipai, Western Mono, Tewa, Zuni
^n	n	342	U+005E U+006E	"nemɑ̱kɑn,nɑqʔɑ,nɯwɯ"	Tümpisa Shoshone (Panamint,Koso), Southern Ute, Chemehuevi, Cora, Kawaiisu, Western Shoshone, Northern Paiute, Tetelcingo Mexicano, Tubar, Shoshone, Cahuilla, Cupeño, Orayvi Hopi, Pochutla Mexicano, Big Smokey Valley Shoshone, Wixarika (Huichol), Comanche, Guarijío, Western Mono, Classical Nahuatl, Arizona Yoeme (Yaqui), Eudeve, Southern Paiute, Serrano, Rarámuri, Ópata, Pipil, Luiseño, Tewa, Kitanemuk, N Tepehuan, Mayo, Pima Bajo, Tongva (Gabrielino), Pahkannil (Tübatulabal), S Tepehuan, Acjachemen (Juaneño), Tohono O'odham, Ipai, Zuni
^o	o	90	U+005E U+006F	"ojoku,otɑ,oɑ"	Pochutla Mexicano, Tümpisa Shoshone (Panamint,Koso), Pima Bajo, Tongva (Gabrielino), Tubar, Zuni, Big Smokey Valley Shoshone, Tewa, Tohono O'odham, Classical Nahuatl, Rarámuri, Guarijío, Arizona Yoeme (Yaqui), Northern Paiute, Kitanemuk, Comanche, Ópata, Tetelcingo Mexicano, S Tepehuan, Chemehuevi, Shoshone, Western Shoshone, N Tepehuan, Mayo, Kawaiisu, Orayvi Hopi, Luiseño, Southern Paiute, Western Mono, Southern Ute, Acjachemen (Juaneño)
^p	p	460	U+005E U+0070	"pukku,puru,pɑɁ"	Tümpisa Shoshone (Panamint,Koso), Big Smokey Valley Shoshone, Shoshone, Southern Ute, Western Shoshone, Comanche, Chemehuevi, Western Mono, Orayvi Hopi, Kawaiisu, Luiseño, Southern Paiute, Northern Paiute, Cupeño, Kitanemuk, Pahkannil (Tübatulabal), Cahuilla, Acjachemen (Juaneño), Guarijío, Serrano, Tongva (Gabrielino), Zuni, Tewa, Classical Nahuatl, Ipai, Pochutla Mexicano, Tohono O'odham, Tetelcingo Mexicano, Arizona Yoeme (Yaqui), Wixarika (Huichol), Mayo, Pipil, N Tepehuan
^q	q	50	U+005E U+0071	"qilɑ̱t,qohi,qø̄tsɑ"	Orayvi Hopi, Luiseño, Cupeño, Serrano, Cahuilla, Western Mono, Acjachemen (Juaneño), Kitanemuk, Southern Paiute, Wixarika (Huichol)
^r	r	34	U+005E U+0072	"rono̱,ru̱ʔɑrɑh,rɑme̱"	Rarámuri, Cora, Guarijío, Tongva (Gabrielino), Wixarika (Huichol), Kitanemuk
^s	s	259	U+005E U+0073	"se,siɑ,sun"	Kawaiisu, Eudeve, Mayo, Rarámuri, Guarijío, Orayvi Hopi, Shoshone, Ópata, Arizona Yoeme (Yaqui), Comanche, Cahuilla, Tümpisa Shoshone (Panamint,Koso), Cora, Big Smokey Valley Shoshone, Tubar, Tewa, Western Shoshone, Southern Ute, Chemehuevi, Tohono O'odham, Tetelcingo Mexicano, Cupeño, Southern Paiute, Zuni, Classical Nahuatl, Pipil, S Tepehuan, Ipai, Western Mono, Northern Paiute, N Tepehuan, Pochutla Mexicano, Tongva (Gabrielino), Luiseño, Acjachemen (Juaneño)
^t	t	689	U+005E U+0074	"tehemet,tɑti,tɑ̄pɯ"	Comanche, Shoshone, Tümpisa Shoshone (Panamint,Koso), Pipil, Western Mono, Big Smokey Valley Shoshone, Kawaiisu, Western Shoshone, Cahuilla, Chemehuevi, Southern Ute, Pochutla Mexicano, Tubar, Arizona Yoeme (Yaqui), Pima Bajo, N Tepehuan, Luiseño, Cora, Southern Paiute, Wixarika (Huichol), Guarijío, Eudeve, Mayo, Orayvi Hopi, Pahkannil (Tübatulabal), Ópata, Serrano, Kitanemuk, Cupeño, Tongva (Gabrielino), Zuni, Classical Nahuatl, Tetelcingo Mexicano, S Tepehuan, Northern Paiute, Acjachemen (Juaneño), Tohono O'odham, Rarámuri, Tewa, Ipai
^u	u	47	U+005E U+0075	"uni,uwi̥,uxúrugi"	Pipil, Kawaiisu, Chemehuevi, Pahkannil (Tübatulabal), Zuni, Southern Ute, S Tepehuan, Southern Paiute, N Tepehuan, Tohono O'odham, Pima Bajo, Guarijío, Pochutla Mexicano, Luiseño, Eudeve, Wixarika (Huichol), Big Smokey Valley Shoshone, Tubar, Northern Paiute, Shoshone, Kitanemuk, Rarámuri
^w	w	240	U+005E U+0077	"wīkit,wōŋ,wɯko"	Tubar, Ipai, Tohono O'odham, Cupeño, Rarámuri, Guarijío, Orayvi Hopi, Cahuilla, Luiseño, Cora, Serrano, Western Mono, Tewa, Ópata, Tümpisa Shoshone (Panamint,Koso), Arizona Yoeme (Yaqui), Kawaiisu, Big Smokey Valley Shoshone, Pahkannil (Tübatulabal), Classical Nahuatl, Southern Ute, Chemehuevi, Tongva (Gabrielino), Kitanemuk, Comanche, Pipil, Tetelcingo Mexicano, Eudeve, Southern Paiute, Northern Paiute, Western Shoshone, Mayo, Acjachemen (Juaneño), Pochutla Mexicano, Shoshone, Zuni, Wixarika (Huichol)
^x	x	10	U+005E U+0078	"xi̱lɑ,xòwàh,xɑj"	Tewa, Tongva (Gabrielino), Cupeño, Luiseño
^í	í	2	U+005E U+00ED	"ímɯi,íɉi"	N Tepehuan
^ó	ó	3	U+005E U+00F3	"ódɑi,ódɑmi,óji"	N Tepehuan
^ø	ø	1	U+005E U+00F8	"øki"	Orayvi Hopi
^ú	ú	3	U+005E U+00FA	"úrɑ,úɑ́mɑ,úβi"	N Tepehuan
^ē	ē	4	U+005E U+0113	"ēko,ēko̥,ēlli"	Comanche, Classical Nahuatl
^ī	ī	32	U+005E U+012B	"ījeltʃiki,īnīnɑ̄nkɑ,ītʃītʃiwɑl"	Tetelcingo Mexicano, Classical Nahuatl, Tohono O'odham, Ipai, Zuni, Pahkannil (Tübatulabal)
^ŋ	ŋ	6	U+005E U+014B	"ŋohots,ŋɑhɯ,ŋɑ̄qɑw"	Kitanemuk, Orayvi Hopi, Cahuilla, Serrano
^ũ	ũ	2	U+005E U+0169	"ũ,ũʔũ"	Tewa
^ū	ū	10	U+005E U+016B	"ū.kɑ̄́,ūme,ūmit"	Pahkannil (Tübatulabal), Wixarika (Huichol), Pipil, Tohono O'odham, S Tepehuan, Pima Bajo
^ɉ	ɟ	3	U+005E U+0249	"ɉiʔi,ɉíβiɑ,ɉīʔ"	S Tepehuan, N Tepehuan
^ə	ə	3	U+005E U+0259	"ət,əʔ,əβət"	Cupeño
^ɬ	ɬ	6	U+005E U+026C	"ɬejɑʔu,ɬito,ɬupt̓si"	Zuni
^ɲ	ɲ	12	U+005E U+0272	"ɲetˢe̱,ɲi̱tʃiʎ,ɲoɑkɑ̱r"	Tohono O'odham, Ipai, Tubar, S Tepehuan, Cahuilla, N Tepehuan
^ʂ	ʂ	33	U+005E U+0282	"ʂuŋɑ̱̄l,ʂūd,ʂɑ̱ŋi"	Wixarika (Huichol), Luiseño, Cupeño, Tongva (Gabrielino), Serrano, Tohono O'odham, Pima Bajo, Kitanemuk
^ʃ	ʃ	39	U+005E U+0283	"ʃulunt,ʃut,ʃū"	Pahkannil (Tübatulabal), Zuni, Acjachemen (Juaneño), Southern Paiute, Tetelcingo Mexicano, Pochutla Mexicano, Classical Nahuatl, Tewa, Pima Bajo, Kitanemuk, S Tepehuan, Pipil, Kawaiisu, N Tepehuan
^ʔ	ʔ	28	U+005E U+0294	"ʔehɑn,ʔe̱ʔnɑn,ʔɑ̱ʔɑlxe"	Ipai, Cahuilla, Luiseño, S Tepehuan, Tewa, Cupeño, Rarámuri, Serrano, Acjachemen (Juaneño)
^β	β	67	U+005E U+03B2	"βuhi,βōʔo,βɑtɑp"	Pima Bajo, Arizona Yoeme (Yaqui), N Tepehuan, Mayo, S Tepehuan, Eudeve, Ópata, Cora, Wixarika (Huichol), Tubar
^θ	θ	1	U+005E U+03B8	"θàn"	Tewa
^ḵ	ḵ/k	4	U+005E U+1E35	"ḵuḵut,ḵūmɑn,ḵɯi"	Serrano
^‑	+	8	U+005E U+2011	"‑kōdɑ-,‑puj-,‑ʔɯt"	Cahuilla, Cupeño, Kitanemuk, Serrano, S Tepehuan
aʳ	a˞	1	U+0061 U+02B3	"ʂɯβaʳtt"	Serrano
bʷ	bʷ	3	U+0062 U+02B7	"hibʷɑne,hɑ̓bʷek"	Arizona Yoeme (Yaqui), Mayo
dh	dh	1	U+0064 U+0068	"oʔodhɑm"	Tohono O'odham
e̓	e̓/eˀ	14	U+0065 U+0313	"rɑme̓ni̱,sɯte̱kutˢɑpe̓,ī̱ne̓"	
e̱	e̠	111	U+0065 U+0331	"he̱piʎ,me̱ɑn,‑me̱kɑn-"	Cahuilla, Eudeve, Cora, Rarámuri, Acjachemen (Juaneño), Guarijío, Luiseño, Tubar, Tongva (Gabrielino), Mayo
hh	hː	2	U+0068 U+0068	"jɑhhɑ,tɑhhi"	Mayo
hs	h s	7	U+0068 U+0073	"kuttuhsippɯh,tohsɑ̱nɑni,ɑuhujei̱hsɯ̓"	Guarijío, Cora, Shoshone, Western Shoshone, Western Mono, Tewa
hw	h w	14	U+0068 U+0077	"tehwɑ,tɯɑhweh,tɯʔɑhweh"	Ipai, Tetelcingo Mexicano, Shoshone, Western Shoshone, Kawaiisu, Eudeve, Tümpisa Shoshone (Panamint,Koso), Big Smokey Valley Shoshone
